[{"id":"dummy-tree","nodes":[{"id":"root","options":[{"label":{"en":"Yes","ja":"はい"},"next":"second"},{"label":{"en":"No","ja":"いいえ"},"result":{"rationale":{"en":"Dummy","ja":"ダミー"},"service":"Cloud Run"}}],"question":{"en":"Dummy question 1","ja":"ダミーの質問 1"}},{"id":"second","options":[{"label":{"en":"Yes","ja":"はい"},"result":{"rationale":{"en":"Dummy","ja":"ダミー"},"service":"GKE"}},{"label":{"en":"No","ja":"いいえ"},"result":{"rationale":{"en":"Dummy","ja":"ダミー"},"service":"Compute Engine"}}],"question":{"en":"Dummy question 2","ja":"ダミーの質問 2"}}],"rootNodeID":"root","title":{"en":"Dummy tree","ja":"ダミーのツリー"}}]